[
  {
    "sku": "NW-DES-001",
    "family": "desk",
    "name": "Northwind Desk 01",
    "dimensions_mm": {
      "width": 1200,
      "depth": 600,
      "height": 740
    },
    "list_price_inr": 18500,
    "labour_minutes": 24,
    "lead_time_days": 13,
    "compatible_finish_ids": [
      "F01",
      "F02",
      "F03",
      "F04",
      "F05",
      "F09",
      "F10",
      "F11",
      "F17"
    ]
  },
  {
    "sku": "NW-DES-002",
    "family": "desk",
    "name": "Northwind Desk 02",
    "dimensions_mm": {
      "width": 1400,
      "depth": 600,
      "height": 760
    },
    "list_price_inr": 19160,
    "labour_minutes": 27,
    "lead_time_days": 16,
    "compatible_finish_ids": [
      "F01",
      "F02",
      "F03",
      "F04",
      "F05",
      "F09",
      "F10",
      "F11",
      "F17"
    ]
  },
  {
    "sku": "NW-DES-003",
    "family": "desk",
    "name": "Northwind Desk 03",
    "dimensions_mm": {
      "width": 1600,
      "depth": 600,
      "height": 780
    },
    "list_price_inr": 19820,
    "labour_minutes": 30,
    "lead_time_days": 19,
    "compatible_finish_ids": [
      "F01",
      "F02",
      "F03",
      "F04",
      "F05",
      "F09",
      "F10",
      "F11",
      "F17"
    ]
  },
  {
    "sku": "NW-DES-004",
    "family": "desk",
    "name": "Northwind Desk 04",
    "dimensions_mm": {
      "width": 1800,
      "depth": 600,
      "height": 740
    },
    "list_price_inr": 20480,
    "labour_minutes": 33,
    "lead_time_days": 7,
    "compatible_finish_ids": [
      "F01",
      "F02",
      "F03",
      "F04",
      "F05",
      "F09",
      "F10",
      "F11",
      "F17"
    ]
  },
  {
    "sku": "NW-DES-005",
    "family": "desk",
    "name": "Northwind Desk 05",
    "dimensions_mm": {
      "width": 1200,
      "depth": 700,
      "height": 760
    },
    "list_price_inr": 21140,
    "labour_minutes": 24,
    "lead_time_days": 10,
    "compatible_finish_ids": [
      "F01",
      "F02",
      "F03",
      "F04",
      "F05",
      "F09",
      "F10",
      "F11",
      "F17"
    ]
  },
  {
    "sku": "NW-DES-006",
    "family": "desk",
    "name": "Northwind Desk 06",
    "dimensions_mm": {
      "width": 1400,
      "depth": 700,
      "height": 780
    },
    "list_price_inr": 21800,
    "labour_minutes": 27,
    "lead_time_days": 13,
    "compatible_finish_ids": [
      "F01",
      "F02",
      "F03",
      "F04",
      "F05",
      "F09",
      "F10",
      "F11",
      "F17"
    ]
  },
  {
    "sku": "NW-DES-007",
    "family": "desk",
    "name": "Northwind Desk 07",
    "dimensions_mm": {
      "width": 1600,
      "depth": 700,
      "height": 740
    },
    "list_price_inr": 22460,
    "labour_minutes": 30,
    "lead_time_days": 16,
    "compatible_finish_ids": [
      "F01",
      "F02",
      "F03",
      "F04",
      "F05",
      "F09",
      "F10",
      "F11",
      "F17"
    ]
  },
  {
    "sku": "NW-DES-008",
    "family": "desk",
    "name": "Northwind Desk 08",
    "dimensions_mm": {
      "width": 1800,
      "depth": 700,
      "height": 760
    },
    "list_price_inr": 23120,
    "labour_minutes": 33,
    "lead_time_days": 19,
    "compatible_finish_ids": [
      "F01",
      "F02",
      "F03",
      "F04",
      "F05",
      "F09",
      "F10",
      "F11",
      "F17"
    ]
  },
  {
    "sku": "NW-DES-009",
    "family": "desk",
    "name": "Northwind Desk 09",
    "dimensions_mm": {
      "width": 1200,
      "depth": 750,
      "height": 780
    },
    "list_price_inr": 23780,
    "labour_minutes": 24,
    "lead_time_days": 7,
    "compatible_finish_ids": [
      "F01",
      "F02",
      "F03",
      "F04",
      "F05",
      "F09",
      "F10",
      "F11",
      "F17"
    ]
  },
  {
    "sku": "NW-DES-010",
    "family": "desk",
    "name": "Northwind Desk 10",
    "dimensions_mm": {
      "width": 1400,
      "depth": 750,
      "height": 740
    },
    "list_price_inr": 24440,
    "labour_minutes": 27,
    "lead_time_days": 10,
    "compatible_finish_ids": [
      "F01",
      "F02",
      "F03",
      "F04",
      "F05",
      "F09",
      "F10",
      "F11",
      "F17"
    ]
  },
  {
    "sku": "NW-DES-011",
    "family": "desk",
    "name": "Northwind Desk 11",
    "dimensions_mm": {
      "width": 1600,
      "depth": 750,
      "height": 760
    },
    "list_price_inr": 25100,
    "labour_minutes": 30,
    "lead_time_days": 13,
    "compatible_finish_ids": [
      "F01",
      "F02",
      "F03",
      "F04",
      "F05",
      "F09",
      "F10",
      "F11",
      "F17"
    ]
  },
  {
    "sku": "NW-DES-012",
    "family": "desk",
    "name": "Northwind Desk 12",
    "dimensions_mm": {
      "width": 1800,
      "depth": 750,
      "height": 780
    },
    "list_price_inr": 25760,
    "labour_minutes": 33,
    "lead_time_days": 16,
    "compatible_finish_ids": [
      "F01",
      "F02",
      "F03",
      "F04",
      "F05",
      "F09",
      "F10",
      "F11",
      "F17"
    ]
  },
  {
    "sku": "NW-DES-013",
    "family": "desk",
    "name": "Northwind Desk 13",
    "dimensions_mm": {
      "width": 1200,
      "depth": 600,
      "height": 740
    },
    "list_price_inr": 26420,
    "labour_minutes": 24,
    "lead_time_days": 19,
    "compatible_finish_ids": [
      "F01",
      "F02",
      "F03",
      "F04",
      "F05",
      "F09",
      "F10",
      "F11",
      "F17"
    ]
  },
  {
    "sku": "NW-DES-014",
    "family": "desk",
    "name": "Northwind Desk 14",
    "dimensions_mm": {
      "width": 1400,
      "depth": 600,
      "height": 760
    },
    "list_price_inr": 27080,
    "labour_minutes": 27,
    "lead_time_days": 7,
    "compatible_finish_ids": [
      "F01",
      "F02",
      "F03",
      "F04",
      "F05",
      "F09",
      "F10",
      "F11",
      "F17"
    ]
  },
  {
    "sku": "NW-DES-015",
    "family": "desk",
    "name": "Northwind Desk 15",
    "dimensions_mm": {
      "width": 1600,
      "depth": 600,
      "height": 780
    },
    "list_price_inr": 27740,
    "labour_minutes": 30,
    "lead_time_days": 10,
    "compatible_finish_ids": [
      "F01",
      "F02",
      "F03",
      "F04",
      "F05",
      "F09",
      "F10",
      "F11",
      "F17"
    ]
  },
  {
    "sku": "NW-DES-016",
    "family": "desk",
    "name": "Northwind Desk 16",
    "dimensions_mm": {
      "width": 1800,
      "depth": 600,
      "height": 740
    },
    "list_price_inr": 28400,
    "labour_minutes": 33,
    "lead_time_days": 13,
    "compatible_finish_ids": [
      "F01",
      "F02",
      "F03",
      "F04",
      "F05",
      "F09",
      "F10",
      "F11",
      "F17"
    ]
  },
  {
    "sku": "NW-DES-017",
    "family": "desk",
    "name": "Northwind Desk 17",
    "dimensions_mm": {
      "width": 1200,
      "depth": 700,
      "height": 760
    },
    "list_price_inr": 29060,
    "labour_minutes": 24,
    "lead_time_days": 16,
    "compatible_finish_ids": [
      "F01",
      "F02",
      "F03",
      "F04",
      "F05",
      "F09",
      "F10",
      "F11",
      "F17"
    ]
  },
  {
    "sku": "NW-DES-018",
    "family": "desk",
    "name": "Northwind Desk 18",
    "dimensions_mm": {
      "width": 1400,
      "depth": 700,
      "height": 780
    },
    "list_price_inr": 29720,
    "labour_minutes": 27,
    "lead_time_days": 19,
    "compatible_finish_ids": [
      "F01",
      "F02",
      "F03",
      "F04",
      "F05",
      "F09",
      "F10",
      "F11",
      "F17"
    ]
  },
  {
    "sku": "NW-DES-019",
    "family": "desk",
    "name": "Northwind Desk 19",
    "dimensions_mm": {
      "width": 1600,
      "depth": 700,
      "height": 740
    },
    "list_price_inr": 30380,
    "labour_minutes": 30,
    "lead_time_days": 7,
    "compatible_finish_ids": [
      "F01",
      "F02",
      "F03",
      "F04",
      "F05",
      "F09",
      "F10",
      "F11",
      "F17"
    ]
  },
  {
    "sku": "NW-DES-020",
    "family": "desk",
    "name": "Northwind Desk 20",
    "dimensions_mm": {
      "width": 1800,
      "depth": 700,
      "height": 760
    },
    "list_price_inr": 31040,
    "labour_minutes": 33,
    "lead_time_days": 10,
    "compatible_finish_ids": [
      "F01",
      "F02",
      "F03",
      "F04",
      "F05",
      "F09",
      "F10",
      "F11",
      "F17"
    ]
  },
  {
    "sku": "NW-DES-021",
    "family": "desk",
    "name": "Northwind Desk 21",
    "dimensions_mm": {
      "width": 1200,
      "depth": 750,
      "height": 780
    },
    "list_price_inr": 31700,
    "labour_minutes": 24,
    "lead_time_days": 13,
    "compatible_finish_ids": [
      "F01",
      "F02",
      "F03",
      "F04",
      "F05",
      "F09",
      "F10",
      "F11",
      "F17"
    ]
  },
  {
    "sku": "NW-DES-022",
    "family": "desk",
    "name": "Northwind Desk 22",
    "dimensions_mm": {
      "width": 1400,
      "depth": 750,
      "height": 740
    },
    "list_price_inr": 32360,
    "labour_minutes": 27,
    "lead_time_days": 16,
    "compatible_finish_ids": [
      "F01",
      "F02",
      "F03",
      "F04",
      "F05",
      "F09",
      "F10",
      "F11",
      "F17"
    ]
  },
  {
    "sku": "NW-DES-023",
    "family": "desk",
    "name": "Northwind Desk 23",
    "dimensions_mm": {
      "width": 1600,
      "depth": 750,
      "height": 760
    },
    "list_price_inr": 33020,
    "labour_minutes": 30,
    "lead_time_days": 19,
    "compatible_finish_ids": [
      "F01",
      "F02",
      "F03",
      "F04",
      "F05",
      "F09",
      "F10",
      "F11",
      "F17"
    ]
  },
  {
    "sku": "NW-DES-024",
    "family": "desk",
    "name": "Northwind Desk 24",
    "dimensions_mm": {
      "width": 1800,
      "depth": 750,
      "height": 780
    },
    "list_price_inr": 33680,
    "labour_minutes": 33,
    "lead_time_days": 7,
    "compatible_finish_ids": [
      "F01",
      "F02",
      "F03",
      "F04",
      "F05",
      "F09",
      "F10",
      "F11",
      "F17"
    ]
  },
  {
    "sku": "NW-CHA-001",
    "family": "chair",